{
  "$schema": "https://json-schema.org/draft/2020-12/schema",
  "$id": "https://tree-doc.org/schemas/tier0.schema.json",
  "title": "Tree Document Format â€” Tier 0",
  "description": "Minimal valid tree document: nodes, edges, format version, and root node ID.",
  "type": "object",
  "required": ["formatVersion", "rootNodeId", "nodes", "edges"],
  "properties": {
    "formatVersion": {
      "type": "string",
      "pattern": "^\\d+\\.\\d+$",
      "description": "Semantic version of the format (e.g. \"1.0\")"
    },
    "rootNodeId": {
      "type": "string",
      "minLength": 1,
      "description": "ID of the root node for the default tree"
    },
    "nodes": {
      "type": "array",
      "items": { "$ref": "#/$defs/node" },
      "description": "All nodes in the document"
    },
    "edges": {
      "type": "array",
      "items": { "$ref": "#/$defs/edge" },
      "description": "All edges connecting nodes"
    }
  },
  "additionalProperties": true,
  "$defs": {
    "node": {
      "type": "object",
      "required": ["id", "content"],
      "properties": {
        "id": {
          "type": "string",
          "minLength": 1,
          "description": "Unique identifier for this node"
        },
        "content": {
          "type": "string",
          "description": "Text content of this node"
        },
        "metadata": {
          "type": "object",
          "description": "Arbitrary metadata attached to this node"
        },
        "status": {
          "type": "string",
          "description": "Workflow status of this node"
        },
        "treeIds": {
          "type": "array",
          "items": { "type": "string" },
          "description": "Tier 2: which trees this node belongs to"
        }
      },
      "additionalProperties": true
    },
    "edge": {
      "type": "object",
      "required": ["source", "target"],
      "properties": {
        "source": {
          "type": "string",
          "minLength": 1,
          "description": "ID of the source node"
        },
        "target": {
          "type": "string",
          "minLength": 1,
          "description": "ID of the target node"
        },
        "isTrunk": {
          "type": "boolean",
          "description": "Whether this edge is part of the trunk path"
        },
        "label": {
          "type": "string",
          "description": "Display label for this edge (e.g. choice text)"
        },
        "type": {
          "type": "string",
          "description": "Edge type classification"
        },
        "status": {
          "type": "string",
          "description": "Workflow status of this edge"
        },
        "description": {
          "type": "string",
          "description": "Longer description of this edge"
        },
        "treeId": {
          "type": "string",
          "description": "Tier 2: which tree this edge belongs to"
        },
        "linkType": {
          "type": "string",
          "description": "Tier 2: cross-tree link classification"
        }
      },
      "additionalProperties": true
    }
  }
}
